{
  "title": "umio config",
  "$schema": "https://json-schema.org/draft/2020-12/schema",
  "type": "object",
  "properties": {
    "$schema": {
      "type": "string"
    },
    "defaultModel": {
      "type": "string",
      "minLength": 1
    },
    "providers": {
      "type": "object",
      "propertyNames": {
        "type": "string"
      },
      "additionalProperties": {
        "oneOf": [
          {
            "type": "object",
            "properties": {
              "type": {
                "type": "string",
                "const": "anthropic"
              },
              "apiKey": {
                "type": "string",
                "minLength": 1
              },
              "baseURL": {
                "type": "string",
                "minLength": 1
              },
              "timeoutMs": {
                "type": "integer",
                "exclusiveMinimum": 0,
                "maximum": 9007199254740991
              },
              "maxRetries": {
                "type": "integer",
                "minimum": 0,
                "maximum": 9007199254740991
              },
              "local": {
                "type": "boolean"
              },
              "maxConcurrentRequests": {
                "type": "integer",
                "exclusiveMinimum": 0,
                "maximum": 9007199254740991
              },
              "transport": {
                "type": "object",
                "properties": {
                  "headersTimeoutMs": {
                    "type": "integer",
                    "exclusiveMinimum": 0,
                    "maximum": 9007199254740991
                  },
                  "bodyTimeoutMs": {
                    "type": "integer",
                    "exclusiveMinimum": 0,
                    "maximum": 9007199254740991
                  }
                },
                "additionalProperties": false
              }
            },
            "required": [
              "type"
            ],
            "additionalProperties": false
          },
          {
            "type": "object",
            "properties": {
              "type": {
                "type": "string",
                "const": "openai"
              },
              "apiKey": {
                "type": "string",
                "minLength": 1
              },
              "organization": {
                "type": "string",
                "minLength": 1
              },
              "baseURL": {
                "type": "string",
                "minLength": 1
              },
              "timeoutMs": {
                "type": "integer",
                "exclusiveMinimum": 0,
                "maximum": 9007199254740991
              },
              "maxRetries": {
                "type": "integer",
                "minimum": 0,
                "maximum": 9007199254740991
              },
              "local": {
                "type": "boolean"
              },
              "maxConcurrentRequests": {
                "type": "integer",
                "exclusiveMinimum": 0,
                "maximum": 9007199254740991
              },
              "transport": {
                "type": "object",
                "properties": {
                  "headersTimeoutMs": {
                    "type": "integer",
                    "exclusiveMinimum": 0,
                    "maximum": 9007199254740991
                  },
                  "bodyTimeoutMs": {
                    "type": "integer",
                    "exclusiveMinimum": 0,
                    "maximum": 9007199254740991
                  }
                },
                "additionalProperties": false
              }
            },
            "required": [
              "type"
            ],
            "additionalProperties": false
          },
          {
            "type": "object",
            "properties": {
              "type": {
                "type": "string",
                "const": "openai-compatible"
              },
              "baseURL": {
                "type": "string",
                "minLength": 1
              },
              "apiKey": {
                "type": "string",
                "minLength": 1
              },
              "timeoutMs": {
                "type": "integer",
                "exclusiveMinimum": 0,
                "maximum": 9007199254740991
              },
              "maxRetries": {
                "type": "integer",
                "minimum": 0,
                "maximum": 9007199254740991
              },
              "local": {
                "type": "boolean"
              },
              "maxConcurrentRequests": {
                "type": "integer",
                "exclusiveMinimum": 0,
                "maximum": 9007199254740991
              },
              "transport": {
                "type": "object",
                "properties": {
                  "headersTimeoutMs": {
                    "type": "integer",
                    "exclusiveMinimum": 0,
                    "maximum": 9007199254740991
                  },
                  "bodyTimeoutMs": {
                    "type": "integer",
                    "exclusiveMinimum": 0,
                    "maximum": 9007199254740991
                  }
                },
                "additionalProperties": false
              }
            },
            "required": [
              "type",
              "baseURL"
            ],
            "additionalProperties": false
          },
          {
            "type": "object",
            "properties": {
              "type": {
                "type": "string",
                "const": "ollama"
              },
              "baseURL": {
                "type": "string",
                "minLength": 1
              },
              "timeoutMs": {
                "type": "integer",
                "exclusiveMinimum": 0,
                "maximum": 9007199254740991
              },
              "maxRetries": {
                "type": "integer",
                "minimum": 0,
                "maximum": 9007199254740991
              },
              "local": {
                "type": "boolean"
              },
              "maxConcurrentRequests": {
                "type": "integer",
                "exclusiveMinimum": 0,
                "maximum": 9007199254740991
              },
              "transport": {
                "type": "object",
                "properties": {
                  "headersTimeoutMs": {
                    "type": "integer",
                    "exclusiveMinimum": 0,
                    "maximum": 9007199254740991
                  },
                  "bodyTimeoutMs": {
                    "type": "integer",
                    "exclusiveMinimum": 0,
                    "maximum": 9007199254740991
                  }
                },
                "additionalProperties": false
              }
            },
            "required": [
              "type"
            ],
            "additionalProperties": false
          }
        ]
      }
    },
    "models": {
      "type": "object",
      "propertyNames": {
        "type": "string"
      },
      "additionalProperties": {
        "type": "object",
        "properties": {
          "provider": {
            "type": "string",
            "minLength": 1
          },
          "model": {
            "type": "string",
            "minLength": 1
          },
          "maxTokens": {
            "type": "integer",
            "exclusiveMinimum": 0,
            "maximum": 9007199254740991
          },
          "options": {
            "type": "object",
            "propertyNames": {
              "type": "string"
            },
            "additionalProperties": {}
          },
          "promptCache": {
            "anyOf": [
              {
                "type": "boolean"
              },
              {
                "type": "object",
                "properties": {
                  "ttl": {
                    "type": "string",
                    "enum": [
                      "5m",
                      "1h"
                    ]
                  }
                },
                "required": [
                  "ttl"
                ],
                "additionalProperties": false
              }
            ]
          },
          "responseCache": {
            "type": "boolean"
          },
          "harness": {
            "anyOf": [
              {
                "type": "string",
                "minLength": 1
              },
              {
                "type": "object",
                "properties": {
                  "system": {
                    "type": "string",
                    "minLength": 1
                  },
                  "middleware": {
                    "type": "array",
                    "items": {
                      "type": "object",
                      "properties": {
                        "use": {
                          "type": "string",
                          "minLength": 1
                        }
                      },
                      "required": [
                        "use"
                      ],
                      "additionalProperties": {}
                    }
                  },
                  "toolLoop": {
                    "type": "object",
                    "properties": {
                      "maxSteps": {
                        "type": "integer",
                        "exclusiveMinimum": 0,
                        "maximum": 9007199254740991
                      },
                      "maxToolOutputChars": {
                        "type": "integer",
                        "exclusiveMinimum": 0,
                        "maximum": 9007199254740991
                      }
                    },
                    "additionalProperties": false
                  }
                },
                "additionalProperties": false
              }
            ]
          }
        },
        "required": [
          "provider",
          "model"
        ],
        "additionalProperties": false
      }
    },
    "responseCache": {
      "oneOf": [
        {
          "type": "object",
          "properties": {
            "store": {
              "type": "string",
              "const": "memory"
            },
            "maxEntries": {
              "type": "integer",
              "exclusiveMinimum": 0,
              "maximum": 9007199254740991
            },
            "ttlSeconds": {
              "type": "number",
              "exclusiveMinimum": 0
            }
          },
          "required": [
            "store"
          ],
          "additionalProperties": false
        },
        {
          "type": "object",
          "properties": {
            "store": {
              "type": "string",
              "const": "file"
            },
            "path": {
              "type": "string",
              "minLength": 1
            },
            "ttlSeconds": {
              "type": "number",
              "exclusiveMinimum": 0
            }
          },
          "required": [
            "store",
            "path"
          ],
          "additionalProperties": false
        }
      ]
    },
    "harnesses": {
      "type": "object",
      "propertyNames": {
        "type": "string"
      },
      "additionalProperties": {
        "type": "object",
        "properties": {
          "system": {
            "type": "string",
            "minLength": 1
          },
          "middleware": {
            "type": "array",
            "items": {
              "type": "object",
              "properties": {
                "use": {
                  "type": "string",
                  "minLength": 1
                }
              },
              "required": [
                "use"
              ],
              "additionalProperties": {}
            }
          },
          "toolLoop": {
            "type": "object",
            "properties": {
              "maxSteps": {
                "type": "integer",
                "exclusiveMinimum": 0,
                "maximum": 9007199254740991
              },
              "maxToolOutputChars": {
                "type": "integer",
                "exclusiveMinimum": 0,
                "maximum": 9007199254740991
              }
            },
            "additionalProperties": false
          }
        },
        "additionalProperties": false
      }
    },
    "adr": {
      "type": "object",
      "properties": {
        "path": {
          "type": "string",
          "minLength": 1
        },
        "include": {
          "type": "array",
          "items": {
            "type": "string",
            "minLength": 1
          }
        },
        "tools": {
          "type": "boolean"
        }
      },
      "required": [
        "path"
      ],
      "additionalProperties": false
    },
    "graph": {
      "type": "object",
      "properties": {
        "maxConcurrency": {
          "type": "integer",
          "exclusiveMinimum": 0,
          "maximum": 9007199254740991
        },
        "maxOutputBytes": {
          "type": "integer",
          "exclusiveMinimum": 0,
          "maximum": 9007199254740991
        },
        "nodeTimeoutMs": {
          "anyOf": [
            {
              "type": "integer",
              "exclusiveMinimum": 0,
              "maximum": 9007199254740991
            },
            {
              "type": "null"
            }
          ]
        },
        "leaseTtlMs": {
          "type": "integer",
          "exclusiveMinimum": 0,
          "maximum": 9007199254740991
        },
        "leaseRenewIntervalMs": {
          "type": "integer",
          "exclusiveMinimum": 0,
          "maximum": 9007199254740991
        },
        "cancelPollIntervalMs": {
          "type": "integer",
          "exclusiveMinimum": 0,
          "maximum": 9007199254740991
        },
        "cancelGraceMs": {
          "type": "integer",
          "minimum": 0,
          "maximum": 9007199254740991
        },
        "observerDrainTimeoutMs": {
          "type": "integer",
          "minimum": 0,
          "maximum": 9007199254740991
        }
      },
      "additionalProperties": false
    },
    "tools": {
      "type": "object",
      "propertyNames": {
        "type": "string"
      },
      "additionalProperties": {
        "type": "object",
        "properties": {
          "use": {
            "type": "string",
            "minLength": 1
          }
        },
        "required": [
          "use"
        ],
        "additionalProperties": {}
      }
    }
  },
  "required": [
    "defaultModel",
    "providers",
    "models"
  ],
  "additionalProperties": false
}
